{
  "schema": "swarm.spine.envelope.v1",
  "issuer": "swarm:ed25519:5fa33029f70d52222fb3e88ab19ad1158158a8da7db100288a4b341e69774622",
  "seq": 8,
  "prev_envelope_hash": "0x9ca8f584e288736174c1ea76c77d744f9177fb3987841e27bedca2ea5f6c2fb1",
  "issued_at": "2026-03-17T09:16:19Z",
  "capability_token": null,
  "fact": {
    "schema": "swarm.perch.receipt.v1",
    "issuer": {
      "swarm_agent_id": "swarm:ed25519:18085f16811dba240c5bf9ef0c0d0bc6f359e7812cdedf86e7519852307ce470",
      "role": null,
      "nostr_pubkey": null
    },
    "emitted_at_ms": 1773738979800,
    "locator": {
      "receipt_id": "resp:hunt-evt-1:lease:hunt-evt-1:isolate_host:1773738979300",
      "trail_id": "trail-3f541a",
      "hunt_id": "hunt-evt-1",
      "case_channel": "27799e23-ab25-4659-b381-3de47ea7ca4d",
      "verdict_card_id": "243aad87527a33433a60e2f990d83de1e84618a69e583fbd8172de4e8fe7d9d8"
    },
    "audit_trail": {
      "trail_id": "trail-3f541a",
      "hunt_id": "hunt-evt-1",
      "related_receipt_ids": [],
      "detection": {
        "finding_id": "suspicious_process_tree:hunt-evt-1",
        "event_id": "hunt-evt-1",
        "threat_class": "execution",
        "severity": "CRITICAL",
        "confidence": 0.9,
        "evidence": {
          "source": "synthetic",
          "parent_process": "WINWORD",
          "process_name": "powershell",
          "command_line": "powershell.exe -enc AAA=",
          "normalized_command_line": "powershell.exe -enc AAA=",
          "decoded_command_segments": [],
          "command_line_transforms": [],
          "user": "alice",
          "host_id": "host-ops-1",
          "heuristics": {
            "encoded_flag": true,
            "download_hint": false
          }
        },
        "strategy_id": "suspicious_process_tree"
      },
      "policy": {
        "verdict": "require_human",
        "rule_name": "static.human_gate",
        "reason": "authorized but held for human approval",
        "lease": {
          "capability_id": "lease:hunt-evt-1:isolate_host:1773738979300",
          "expires_at_ms": 1773739039300,
          "action": "isolate_host",
          "scope": "host-ops-1"
        }
      },
      "response": {
        "kind": "success",
        "receipt_id": "resp:hunt-evt-1:lease:hunt-evt-1:isolate_host:1773738979300",
        "action": "isolate_host",
        "mode": "enforced",
        "status": "executed",
        "summary": "sandbox Enforced for isolate_host",
        "details": {
          "mode": "enforced",
          "capability_id": "lease:hunt-evt-1:isolate_host:1773738979300",
          "scope": "host-ops-1",
          "requested_by": "swarm:ed25519:18085f16811dba240c5bf9ef0c0d0bc6f359e7812cdedf86e7519852307ce470"
        },
        "audit": {
          "policy": {
            "verdict": "require_human",
            "rule_name": "static.human_gate",
            "reason": "authorized but held for human approval"
          },
          "approved_by": {
            "operator_id": "perch-operator-1",
            "voter_id": "swarm:ed25519:bcefbd06b2c7d3bc00587150b85deb7d241d3540a194ecd1c2d88b2afd203ded",
            "hold_id": "h_a07aeacf",
            "decided_at_ms": 1773738979300,
            "signature": {
              "algorithm": "ed25519",
              "key_id": "perch-operator-1",
              "public_key_hex": "bcefbd06b2c7d3bc00587150b85deb7d241d3540a194ecd1c2d88b2afd203ded",
              "signature_hex": "cf66da852831018f3171f4d2da1e1a0a9868db7080d577ccbb2567cd71946953d53595d0364b3b60478ae7f9392daf71183ef06366b37a01253aaf1742825135"
            },
            "nostr_intent_event_id": "243aad87527a33433a60e2f990d83de1e84618a69e583fbd8172de4e8fe7d9d8"
          }
        }
      },
      "created_at_ms": 1773738979800
    }
  },
  "envelope_hash": "0x9d0db3b5f33136aec9867e9f137b017ed004fcfebcb1895a1f89d0b1c104a26c"
}
