{
  "capability_token": null,
  "envelope_hash": "0xabababababababababababababababababababababababababababababababab",
  "fact": {
    "emitted_at_ms": 1787755931950,
    "issuer": {
      "nostr_pubkey": null,
      "role": "pouncer",
      "swarm_agent_id": "containment-sweep"
    },
    "locator": {
      "case_channel": "b21d55aa-9c37-4f10-8e0a-77b3d5c19042",
      "lease_card_id": "cccccccccccccccccccccccccccccccccccccccccccccccccccccccccccccccc",
      "lease_id": "cl_51aa",
      "rollback_id": "rb_9c02"
    },
    "partition_state_at_execution": "healthy",
    "rollback_receipt": {
      "completed_at_ms": 1787755931950,
      "governance_receipt_id": null,
      "lease_id": "cl_51aa",
      "mode": "enforced",
      "origin_receipt_id": "resp-contain:tel-8831:lease:web-04",
      "rollback_id": "rb_9c02",
      "status": "executed",
      "steps": [
        {
          "detail": "web-04 network interfaces re-enabled",
          "kind": "restore_host_connectivity",
          "status": "reversed"
        }
      ],
      "summary": "1 of 1 steps reversed",
      "trigger": "expiry"
    },
    "schema": "ambush.perch.rollback.v1"
  },
  "issued_at": "2026-08-30T02:41:07Z",
  "issuer": "swarm:ed25519:9f3c000000000000000000000000000000000000000000000000000000000000",
  "prev_envelope_hash": "0xabababababababababababababababababababababababababababababababab",
  "schema": "swarm.spine.envelope.v1",
  "seq": 7
}
