{
  "capability_token": null,
  "envelope_hash": "0xabababababababababababababababababababababababababababababababab",
  "fact": {
    "audit_trail": {
      "created_at_ms": 1787755031788,
      "detection": {
        "confidence": 0.82,
        "event_id": "tel-8831",
        "evidence": {
          "query_count": 411
        },
        "finding_id": "f2c9a1b4",
        "severity": "HIGH",
        "strategy_id": "dns_exfil_beaconing",
        "threat_class": "data_exfiltration"
      },
      "hunt_id": "tel-8831",
      "policy": {
        "lease": {
          "action": "isolate_host",
          "capability_id": "lease:tel-8831:isolate_host:1787755031004",
          "expires_at_ms": 1787755091004,
          "scope": "web-04"
        },
        "reason": "authorized but held for human approval",
        "rule_name": "static.human_gate",
        "verdict": "require_human"
      },
      "related_receipt_ids": [],
      "response": {
        "action": "isolate_host",
        "audit": {
          "policy": {
            "reason": "authorized but held for human approval",
            "rule_name": "static.human_gate",
            "verdict": "require_human"
          }
        },
        "details": {},
        "kind": "success",
        "mode": "enforced",
        "receipt_id": "resp-contain:tel-8831:lease:web-04",
        "status": "executed",
        "summary": "host web-04 isolated"
      },
      "trail_id": "trail-4411"
    },
    "emitted_at_ms": 1787755031788,
    "issuer": {
      "nostr_pubkey": null,
      "role": "pouncer",
      "swarm_agent_id": "pouncer-2b18"
    },
    "locator": {
      "case_channel": "b21d55aa-9c37-4f10-8e0a-77b3d5c19042",
      "hunt_id": "tel-8831",
      "receipt_id": "resp-contain:tel-8831:lease:web-04",
      "trail_id": "trail-4411",
      "verdict_card_id": "aaaaaaaaaaaaaaaaaaaaaaaaaaaaaaaaaaaaaaaaaaaaaaaaaaaaaaaaaaaaaaaa"
    },
    "schema": "swarm.perch.receipt.v1"
  },
  "issued_at": "2026-08-30T02:41:07Z",
  "issuer": "swarm:ed25519:9f3c000000000000000000000000000000000000000000000000000000000000",
  "prev_envelope_hash": "0xabababababababababababababababababababababababababababababababab",
  "schema": "swarm.spine.envelope.v1",
  "seq": 5
}
