{
  "capability_token": null,
  "envelope_hash": "0xabababababababababababababababababababababababababababababababab",
  "fact": {
    "emitted_at_ms": 1787754972123,
    "finding": {
      "confidence": 0.82,
      "event_id": "tel-8831",
      "evidence": {
        "entropy": 4.7,
        "query_count": 411
      },
      "finding_id": "f2c9a1b4",
      "schema": "swarm_finding",
      "severity": "HIGH",
      "strategy_id": "dns_exfil_beaconing",
      "threat_class": "data_exfiltration"
    },
    "issuer": {
      "nostr_pubkey": null,
      "role": "whisker",
      "swarm_agent_id": "whisker-7a3f"
    },
    "locator": {
      "event_id": "tel-8831",
      "finding_id": "f2c9a1b4",
      "host_id": "web-04",
      "lane_channel": "3f1e77c2-0b41-4c6a-9d55-8ac1e2f40911",
      "strategy_id": "dns_exfil_beaconing"
    },
    "schema": "ambush.perch.finding.v1"
  },
  "issued_at": "2026-08-30T02:41:07Z",
  "issuer": "swarm:ed25519:9f3c000000000000000000000000000000000000000000000000000000000000",
  "prev_envelope_hash": null,
  "schema": "swarm.spine.envelope.v1",
  "seq": 1
}
