{
  "capability_token": null,
  "envelope_hash": "0xabababababababababababababababababababababababababababababababab",
  "fact": {
    "emitted_at_ms": 1787755031900,
    "issuer": {
      "nostr_pubkey": null,
      "role": "pouncer",
      "swarm_agent_id": "pouncer-2b18"
    },
    "lease": {
      "action": {
        "host_id": "web-04",
        "type": "isolate_host"
      },
      "blast_radius": {
        "affected_capabilities": [
          "network.egress",
          "network.ingress"
        ],
        "impact": "host_connectivity_isolated",
        "max_affected_scopes": 1,
        "scope_kind": "host",
        "scope_value": "web-04",
        "summary": "one host loses network connectivity"
      },
      "expires_at_ms": 1787755931900,
      "governance_receipt_id": null,
      "issued_at_ms": 1787755031900,
      "lease_id": "cl_51aa",
      "origin_receipt_id": "resp-contain:tel-8831:lease:web-04",
      "rollback": {
        "required": true,
        "steps": [
          {
            "kind": "restore_host_connectivity",
            "summary": "re-enable web-04 network interfaces"
          }
        ],
        "summary": "restore host connectivity"
      },
      "schema_version": 1
    },
    "locator": {
      "case_channel": "b21d55aa-9c37-4f10-8e0a-77b3d5c19042",
      "lease_id": "cl_51aa",
      "origin_receipt_id": "resp-contain:tel-8831:lease:web-04",
      "receipt_card_id": "bbbbbbbbbbbbbbbbbbbbbbbbbbbbbbbbbbbbbbbbbbbbbbbbbbbbbbbbbbbbbbbb"
    },
    "schema": "swarm.perch.lease.v1",
    "ttl_source": "runtime.containment.lease_ttl_ms"
  },
  "issued_at": "2026-08-30T02:41:07Z",
  "issuer": "swarm:ed25519:9f3c000000000000000000000000000000000000000000000000000000000000",
  "prev_envelope_hash": "0xabababababababababababababababababababababababababababababababab",
  "schema": "swarm.spine.envelope.v1",
  "seq": 6
}
