{
  "capability_token": null,
  "envelope_hash": "0xabababababababababababababababababababababababababababababababab",
  "fact": {
    "emitted_at_ms": 1773738882600,
    "hold": {
      "action_kind": "isolate_host",
      "action_request": {
        "action": {
          "host_id": "host-ops-1",
          "type": "isolate_host"
        },
        "evidence": {
          "escalation": {
            "threat_class": "execution"
          }
        },
        "hunt_id": "hunt-evt-1",
        "requested_by": "swarm:ed25519:18085f16811dba240c5bf9ef0c0d0bc6f359e7812cdedf86e7519852307ce470",
        "severity": "CRITICAL"
      },
      "decision": null,
      "expires_at_ms": 1773742482600,
      "held_at_ms": 1773738882600,
      "hold_id": "h_a07aeacf",
      "inverse_resolution": [],
      "leases_a_containment": true,
      "policy_decision": {
        "reason": "authorized but held for human approval",
        "rule_name": "static.human_gate",
        "verdict": "require_human"
      },
      "rationale": {
        "concentration_at_hold": {
          "distinct_sources": 2,
          "peak_confidence": 0.9,
          "threat_class": "execution",
          "total_strength": 2.696884
        },
        "escalation_level": "alert",
        "governance_receipt_present": false,
        "reason": "authorized but held for human approval",
        "request_carried_fields": [
          "severity",
          "threat_class"
        ],
        "rule_name": "static.human_gate",
        "severity": "CRITICAL",
        "threat_class": "execution"
      },
      "rehearsal": null,
      "severity": "CRITICAL",
      "state": "created"
    },
    "issuer": {
      "nostr_pubkey": null,
      "role": null,
      "swarm_agent_id": "swarm:ed25519:18085f16811dba240c5bf9ef0c0d0bc6f359e7812cdedf86e7519852307ce470"
    },
    "locator": {
      "case_channel": "27799e23-ab25-4659-b381-3de47ea7ca4d",
      "finding_card_id": "ad87733a20dc8c74e001bd9f60db48f01ad01513b3ea0df29c471b3872e9874a",
      "hold_id": "h_a07aeacf",
      "hunt_id": "hunt-evt-1"
    },
    "schema": "ambush.perch.hold.v1"
  },
  "issued_at": "2026-03-17T09:14:42Z",
  "issuer": "swarm:ed25519:5fa33029f70d52222fb3e88ab19ad1158158a8da7db100288a4b341e69774622",
  "prev_envelope_hash": "0xabababababababababababababababababababababababababababababababab",
  "schema": "swarm.spine.envelope.v1",
  "seq": 3
}
